[
  {
    "id": 3658,
    "title": "LONESTAR (Epic Games) Giveaway",
    "worth": "$12.99",
    "thumbnail": "https://www.gamerpower.com/offers/1/lonestar.jpg",
    "image": "https://www.gamerpower.com/offers/1b/lonestar.jpg",
    "description": "Claim LONESTAR free on the Epic Games Store this week.",
    "instructions": "1. Click the button to visit the giveaway page.\r\n2. Add to library on Epic Games Store.",
    "open_giveaway_url": "https://www.gamerpower.com/open/lonestar-epic-games-giveaway",
    "published_date": "2026-05-28 09:15:00",
    "type": "Game",
    "platforms": "PC, Epic Games Store",
    "end_date": "2026-06-04 16:00:00",
    "users": 4820,
    "status": "Active",
    "gamerpower_url": "https://www.gamerpower.com/lonestar-epic-games-giveaway",
    "open_giveaway": "https://www.gamerpower.com/open/lonestar-epic-games-giveaway"
  }
]
