{
  "id": 3664,
  "title": "Moonrise Fall (Steam) Giveaway",
  "worth": "$9.99",
  "thumbnail": "https://www.gamerpower.com/offers/1/6a1b24ffbbc52.jpg",
  "image": "https://www.gamerpower.com/offers/1b/6a1b24ffbbc52.jpg",
  "description": "Download Moonrise Fall for free on Steam until June 2! Moonrise Fall is a 2d exploration puzzle game with an immersive pixel graphics world and unique puzzles to solve.",
  "instructions": "1. Click the button to visit the giveaway page.\r\n2. Download this game directly via Steam before the offer expires.\r\n3. That's it! Have fun!",
  "open_giveaway_url": "https://www.gamerpower.com/open/moonrise-fall-steam-giveaway",
  "published_date": "2026-05-30 13:57:19",
  "type": "Game",
  "platforms": "PC, Steam",
  "end_date": "2026-06-02 23:59:00",
  "users": 1310,
  "status": "Active",
  "gamerpower_url": "https://www.gamerpower.com/moonrise-fall-steam-giveaway",
  "open_giveaway": "https://www.gamerpower.com/open/moonrise-fall-steam-giveaway"
}
