[
  {
    "id": 3661,
    "title": "World of Tanks: Heat Gift Pack Key Giveaway",
    "worth": "N/A",
    "thumbnail": "https://www.gamerpower.com/offers/1/6a18902b0e176.jpg",
    "image": "https://www.gamerpower.com/offers/1b/6a18902b0e176.jpg",
    "description": "Claim your free World of Tanks: Heat Gift Pack Key via AMD Gaming.",
    "instructions": "1. Click the button to visit the giveaway page.\r\n2. Log in to your free AMD Gaming account and click the button to unlock your key.\r\n3. Follow the redemption instructions.",
    "open_giveaway_url": "https://www.gamerpower.com/open/world-of-tanks-heat-gift-pack-key-giveaway",
    "published_date": "2026-05-29 11:00:00",
    "type": "DLC",
    "platforms": "PC",
    "end_date": "N/A",
    "users": 980,
    "status": "Active",
    "gamerpower_url": "https://www.gamerpower.com/world-of-tanks-heat-gift-pack-key-giveaway",
    "open_giveaway": "https://www.gamerpower.com/open/world-of-tanks-heat-gift-pack-key-giveaway"
  }
]
